"motive_category","surface_motive","hidden_motive","trigger_event","contradiction_risk","behavioral_indicators","hypothesis_value","notes"
"guilt","offer explanation","seek partial forgiveness","question about past choice","high","rambling talk; self blame hints","0.83","Shapes late stage accounts."
"revenge","exclude name","erase rival from credit","success summary","high","pointed omissions; tight smile","0.82","Narrative erasure motive."
"habit","check phone","fill tiny gaps","micro break","low","micro glances; half attention","0.42","Background noise motive."
"boredom","spin object","keep hands busy","slow briefing","low","fidgeting; wandering gaze","0.41","Dilutes recall of surrounding talk."
"social_pressure","sign up","avoid being only one out","team activity list","medium","hesitant pen; later regret","0.60","Membership driven choice."
"desperation","accept lowest option","escape looming cut","budget talk","high","flat tone; resigned posture","0.84","Endgame style motive."
"protect_child","sit closer","block harsh sound","loud argument","medium","shielding posture; soothing whispers","0.66","Sensory protection focus."
"professional_duty","keep record","anticipate later audit","busy period","medium","constant noting; time anchors","0.70","Strengthens chronology."
"territoriality","lock drawer","restrict casual entry","shared desk","medium","short comments; firm clicks","0.69","Physical boundary expression."
"competition","copy metrics","compare in secret","performance board","medium","covert glances; silent tally","0.67","Silent scoreboard motive."
"romantic_interest","offer umbrella","extend shared path","rain starting","medium","light joke; slowed pace","0.56","Side story generator."
"status_anxiety","ask about ranking","fear slipping down","evaluation talk","medium","probing questions; nervous laugh","0.62","Metric focused motive."
"paranoia","check behind","feel watched","empty corridor","high","fast turns; hushed tone","0.78","Subjective threat lens."
"fatigue","mishear words","answer wrong topic","end shift chat","low","blinking slowly; late correction","0.47","Explains stray responses."
"carelessness","leave bag","forget it behind","bag unattended","low","head shake; rushed return","0.48","Unintentional trigger motive."
"overconfidence","promise too much","underestimate effort","planning phase","medium","grand statements; skimpy plan","0.71","Fuel for later letdown."
"testing_boundaries","ignore minor sign","see if rule is real","small warning label","medium","shrug; continued behavior","0.58","Probes enforcement line."
"people_pleasing","host extra","avoid saying no","gathering request","medium","warm tone; overcommitting","0.61","Seeds future strain."
"suspicion","take photo","log possible issue","odd pattern","medium","quick snapshot; quiet saving","0.63","Creates trace without strong claim."
"hope","mark date","expect change soon","upcoming event","low","calendar focus; upbeat talk","0.46","Future oriented motive."
"nostalgia","keep old pass","hold onto symbol","expired card","low","drawer storage; fond glance","0.44","Symbolic weight only."
"regret","decline repeat","avoid same mistake","similar offer","medium","careful refusal; long pause","0.65","Lesson integrated motive."
"obligation_family","bring up need","push shared responsibility","care talk","medium","firm request; emotional undertone","0.64","Rebalances duty map."
"financial_stress","take extra hour","chase small increase","overtime slot","medium","quick yes; tired eyes","0.72","Economically anchored motive."
"peer_influence","shift opinion","align with louder voice","heated group debate","medium","changed phrasing; later echoing","0.60","Dynamic motive in groups."
"confusion","reverse order","tell end before start","fast retell","medium","out of sequence details; later correction","0.55","Key for timeline repair."
"overwhelm","pause mid word","brain freeze moment","rapid instruction","medium","open mouth; no sound","0.57","Capacity spike marker."
"routine_shortcut","reuse password","avoid new creation","system prompt","low","same pattern; quick typing","0.50","Convenience based choice."
"impression_management","hide fatigue","smile through strain","busy period","medium","bright tone; small slips","0.72","Mask that cracks with time."